"ama:Coordinate:2                     ama:calendar:2                       Value:Julian","Value","Julian","","","Julian calendar."
"ama:Coordinate:2                     ama:calendar:2                       Value:Noleap","Value","Noleap","","","Gregorian calendar without leap years, i.e., all years are 365 days long. (Same as 365_Day.)"
"ama:Coordinate:2                     ama:calendar:2                       Value:None","Value","None","","","No calendar."
"ama:Coordinate:2                     ama:calendar:2                       Value:Proleptic_Gregorian","Value","Proleptic_Gregorian","","","A Gregorian calendar extended to dates before 1582-10-15. That is, a year is a leap year if either (i) it is divisible by 4 but not by 100 or (ii) it is divisible by 400."
"ama:Coordinate:2                     ama:calendar:2                       Value:Standard","Value","Standard","","","Mixed Gregorian/Julian calendar as defined by Udunits. This is the default. (Same as Gregorian.)"
"ama:Coordinate:2                     ama:day_length:1                    ","Attribute","day_length","n/a","ama","The unit of the variable in the file","atm","ASCII_Real","0","1","-1.7976931348623157e308","1.7976931348623157e308","Unbounded","Unbounded","Units_of_Time","none","TBD_classConcept","REAL"
"ama:Coordinate:2                     ama:month_length:1                  ","Attribute","month_length","n/a","ama","If none of the calendar types apply, a non-standard calendar can be defined. The user must explicitly define the number of days per month","atm","ASCII_Real","0","1","-1.7976931348623157e308","1.7976931348623157e308","Unbounded","Unbounded","Units_of_Time","none","TBD_classConcept","REAL"
"ama:Coordinate:2                     ama:maximum_boundary:1              ","Attribute","maximum_boundary","n/a","ama","the maximum boundary of the coordinate","atm","ASCII_Real","0","1","-1.7976931348623157e308","1.7976931348623157e308","Unbounded","Unbounded","Units_of_None","none","TBD_classConcept","REAL"
"ama:Coordinate:2                     ama:minimum_boundary:1              ","Attribute","minimum_boundary","n/a","ama","the minimum boundary of the coordinate","atm","ASCII_Real","0","1","-1.7976931348623157e308","1.7976931348623157e308","Unbounded","Unbounded","Units_of_None","none","TBD_classConcept","REAL"
"ama:Coordinate:2                     ama:description:1                   ","Attribute","description","n/a","ama","he description attribute can be used to describe the specific simulation configuration, including specific inputs, parameterizations, variable, processing, etc in greater detail.","atm","ASCII_Short_String_Collapsed","0","1","Unbounded","Unbounded","1","255","Units_of_None","none","TBD_classConcept","SHORT_STRING"
"ama:Model_Output:1                  ","Class","Model_Output","1.0.0.0","ama","The Model_Output class contains those attributes and sub-classes that describe the model output. Model output includes coordinate, dimensions and variable products as well as information about variable processing, for example, to generate figure data. Most attributes are generated automatically from the python script ","atm","","","","","","","","","","",""
"ama:AMA:1                           ","Class","AMA","1.0.0.0","ama","This is the umbrella class for the AMA (Atmospheric Modeling Annex) local dictionary.","atm","","","","","","","","","","",""
